{
  "schemaVersion": 4,
  "phases": [
    {
      "key": "discovery",
      "label": "Per-task craft",
      "blurb": "Framing each task and proving it's done — the work-specific arc."
    },
    {
      "key": "cross_cutting",
      "label": "Session-wide habits",
      "blurb": "Discipline that runs across the whole session, not one task."
    }
  ],
  "tiers": [
    {
      "key": "strong",
      "label": "Strong",
      "shortLabel": "Strong",
      "intent": "good",
      "hex": "#28c840",
      "text": "#28c840",
      "badge": {
        "color": "#28c840",
        "background": "rgba(40, 200, 64, 0.10)",
        "border": "1px solid rgba(40, 200, 64, 0.28)"
      },
      "rank": 4,
      "help": "Senior-level demonstration on this dimension.",
      "structural": false
    },
    {
      "key": "adequate",
      "label": "Adequate",
      "shortLabel": "Adequate",
      "intent": "good",
      "hex": "#febc2e",
      "text": "#febc2e",
      "badge": {
        "color": "#febc2e",
        "background": "rgba(254, 188, 46, 0.10)",
        "border": "1px solid rgba(254, 188, 46, 0.30)"
      },
      "rank": 3,
      "help": "Meets the baseline for this dimension.",
      "structural": false
    },
    {
      "key": "developing",
      "label": "Developing",
      "shortLabel": "Developing",
      "intent": "gap",
      "hex": "#ef4444",
      "text": "#f87171",
      "badge": {
        "color": "#f87171",
        "background": "rgba(239, 68, 68, 0.10)",
        "border": "1px solid rgba(239, 68, 68, 0.28)"
      },
      "rank": 1,
      "help": "Evidence is present but falls short — the highest-leverage place to improve.",
      "structural": false
    },
    {
      "key": "insufficient_evidence",
      "label": "Not enough signal",
      "shortLabel": "No signal",
      "intent": "neutral",
      "hex": "#8a8a96",
      "text": "#8a8a96",
      "badge": {
        "color": "#8a8a96",
        "background": "rgba(138, 138, 150, 0.08)",
        "border": "1px solid rgba(138, 138, 150, 0.24)"
      },
      "rank": 0,
      "help": "This behavior didn't occur or produced too little signal to grade. Not a weakness.",
      "structural": false
    },
    {
      "key": "not_collectible",
      "label": "Not capturable",
      "shortLabel": "N/A",
      "intent": "neutral",
      "hex": "#94a3b8",
      "text": "rgba(148, 163, 184, 0.92)",
      "badge": {
        "color": "rgba(148, 163, 184, 0.92)",
        "background": "rgba(148, 163, 184, 0.06)",
        "border": "1px dashed rgba(148, 163, 184, 0.40)"
      },
      "rank": 0,
      "help": "This agent can't emit the telemetry for this dimension (e.g. no token signal on Cursor). Not a reflection of the engineer.",
      "structural": true
    }
  ],
  "dimensions": [
    {
      "key": "domain",
      "label": "Domain",
      "phase": "discovery",
      "surfaces": [
        "hiring"
      ],
      "requiredCapabilities": [
        "hidden_spec"
      ],
      "reliabilityTier": "high",
      "measures": "Whether the candidate reconstructed what the system needs from the ticket and the people who hold the missing requirements.",
      "detail": "Domain compares the candidate-authored spec with the hidden requirement rows, one requirement at a time. Each row is recovered, missed, or correctly cut when a teammate rules out a ticket implication. The comparison is grounded in the fixed answer key and cited session events, not an impression of the conversation. Code conformance is reported beside a row where tests can establish it. Without a hidden spec or a candidate-authored spec, there is no diff to grade and Domain is not collectible.",
      "anchors": {
        "developing": "The spec misses substantial hidden requirements or carries a ticket implication that should have been cut; the diff shows the system was built for the wrong target.",
        "adequate": "The diff recovers most hidden requirements and correctly cuts known false implications, but one or more material needs are missed.",
        "strong": "The diff recovers the hidden requirements, including needs nobody volunteered, and correctly cuts false ticket implications; tested code conforms to the resulting spec."
      },
      "subFacets": [
        {
          "key": "recovered",
          "label": "Requirements recovered",
          "reliabilityTier": "high",
          "signal": "Hidden requirements present in the candidate spec, with the message or other event that supports each recovery.",
          "anchors": {
            "developing": "The diff marks many hidden requirements missed; the candidate spec mostly repeats the ticket.",
            "adequate": "Most hidden requirements are recovered in the candidate spec with traceable evidence, but some are missed.",
            "strong": "The candidate spec recovers all hidden requirements that the available evidence could establish, including less obvious needs."
          }
        },
        {
          "key": "cut",
          "label": "Deliberate cuts",
          "reliabilityTier": "high",
          "signal": "Ticket implications ruled out by a teammate and correctly omitted from the candidate spec, with the ruling cited.",
          "anchors": {
            "developing": "A contradicted ticket implication remains in the spec or disappears without a supported reason.",
            "adequate": "The candidate identifies the false implication but leaves it softened or ambiguous in the spec.",
            "strong": "The candidate cuts the false implication from the spec and cites the ruling that justified the cut."
          }
        },
        {
          "key": "unasked",
          "label": "What was never asked",
          "reliabilityTier": "medium",
          "signal": "Hidden requirements with no assigned holder, and whether the candidate raised the question that could expose them.",
          "anchors": {
            "developing": "A requirement nobody held is missed because its ownership, rollout, or failure behavior was never raised.",
            "adequate": "The candidate probes some unowned needs but the diff still shows a material one missed.",
            "strong": "The candidate raises the questions needed to recover unowned requirements, and the resulting spec covers them."
          }
        },
        {
          "key": "conformance",
          "label": "Conformance to spec",
          "reliabilityTier": "medium",
          "signal": "For requirements covered by tests, whether shipped code meets the candidate spec and the hidden requirement.",
          "anchors": {
            "developing": "Tested code fails a requirement that the candidate wrote into the spec.",
            "adequate": "Tested code conforms to the candidate spec, but that spec still misses a hidden need.",
            "strong": "Tested code conforms to the candidate spec and the corresponding hidden requirements."
          }
        }
      ],
      "sources": [
        {
          "name": "Anthropic",
          "detail": "Clarify requirements and verify implementation against explicit criteria",
          "url": "https://code.claude.com/docs/en/best-practices"
        },
        {
          "name": "Mitchell Hashimoto",
          "detail": "Plan from requirements before coding and review the resulting work",
          "url": "https://mitchellh.com/writing/non-trivial-vibing"
        }
      ]
    },
    {
      "key": "direction",
      "label": "Direction",
      "phase": "discovery",
      "surfaces": [
        "hiring",
        "teams"
      ],
      "reliabilityTier": "medium",
      "measures": "Whether the engineer set the agent up to succeed — specific asks, the context only they have, and work shaped so each step could be done right.",
      "detail": "Direction is everything the engineer controls before and while the agent works: how precisely each ask is stated, how much of the context only they possess gets handed over, and how the work is shaped so every step has what it needs. The highest-value part is latent context — the intent, scale assumptions, and non-goals the agent cannot discover from the repo (\"we'll only ever have one user\"). Withholding it doesn't cost turns; it produces confidently-wrong output. Structuring is the counterweight to naive decomposition: over-chop the work and each step is locally fine but globally wrong because no unit saw the whole — plan-then-execute (plan mode where it earns it) is how you decompose without starving context. Judged from prompt content and work shape, not from raw turn count, which conflates prompt quality with task difficulty.",
      "anchors": {
        "developing": "Vague asks with the context left in the engineer's head; work sprawls or fragments.",
        "adequate": "Clear goal and rough shape, but key intent, constraints, or ordering stay implicit.",
        "strong": "Specific asks carrying the context only they have, shaped so each step can be done right."
      },
      "subFacets": [
        {
          "key": "specificity",
          "label": "Specificity",
          "reliabilityTier": "medium",
          "signal": "What each prompt pins down — expected-vs-actual behavior, constraints, acceptance criteria, pasted evidence — versus what's left to the model to guess.",
          "anchors": {
            "developing": "Vague asks ('fix it') — no target behavior, no constraints, no acceptance bar.",
            "adequate": "Names the goal and some constraints, but leaves room for the agent to guess.",
            "strong": "Pins expected behavior, constraints, and the acceptance check in a single ask."
          }
        },
        {
          "key": "latent_context",
          "label": "Latent context",
          "reliabilityTier": "medium",